{
  "$schema":"https://json-schema.org/draft/2020-12/schema","$id":"carr-control-room-telemetry-measurement-v1","contract":"carr-control-room-telemetry-measurement","version":"1.0.0","status":"phase0_contract_foundation_not_deployed","$comment":"A redacted measurement truth envelope. Absence is unavailable, never zero. PTY text/existence is not an allowed lifecycle/activity source.","title":"CARR Telemetry Measurement v1","type":"object","additionalProperties":false,
  "required":["schema_version","measurement_id","metric_kind","unit","scope","attribution","source","observed_at","source_window","freshness","value"],
  "properties":{"schema_version":{"const":"telemetry-measurement.v1"},"measurement_id":{"$ref":"#/$defs/Id"},"metric_kind":{"enum":["subscription_quota","session_tokens","billed_cost","elapsed_time","lifecycle_activity","other"]},"unit":{"type":"string","minLength":1},"scope":{"type":"string","minLength":1},"attribution":{"$ref":"#/$defs/Attribution"},"source":{"$ref":"#/$defs/Source"},"observed_at":{"$ref":"#/$defs/Timestamp"},"source_window":{"$ref":"#/$defs/Window"},"freshness":{"enum":["fresh","stale","unknown"]},"value":{"$ref":"#/$defs/Value"}},
  "$defs":{"Id":{"type":"string","pattern":"^[A-Za-z][A-Za-z0-9._:-]{2,127}$"},"Timestamp":{"type":"string","pattern":"^\\d{4}-\\d{2}-\\d{2}T\\d{2}:\\d{2}:\\d{2}Z$"},"Attribution":{"type":"object","additionalProperties":false,"required":["provider_id","model_id","harness_id","adapter_id","attempt_id","native_session_ref"],"properties":{"provider_id":{"$ref":"#/$defs/Id"},"model_id":{"$ref":"#/$defs/Id"},"harness_id":{"$ref":"#/$defs/Id"},"adapter_id":{"$ref":"#/$defs/Id"},"attempt_id":{"$ref":"#/$defs/Id"},"native_session_ref":{"oneOf":[{"$ref":"#/$defs/Id"},{"type":"null"}]} }},"Source":{"type":"object","additionalProperties":false,"required":["type","priority","provenance_ref"],"properties":{"type":{"enum":["structured_provider_event","official_provider_api","documented_cli_json","deterministic_local_clock","unavailable"]},"priority":{"type":"integer","minimum":1,"maximum":5},"provenance_ref":{"type":"string","minLength":1}}},"Window":{"type":"object","additionalProperties":false,"required":["started_at","ended_at"],"properties":{"started_at":{"$ref":"#/$defs/Timestamp"},"ended_at":{"$ref":"#/$defs/Timestamp"}}},"Value":{"type":"object","additionalProperties":false,"required":["kind","amount","estimate_method","uncertainty","unavailable_reason"],"properties":{"kind":{"enum":["actual","estimate","unavailable"]},"amount":{"oneOf":[{"type":"number"},{"type":"null"}]},"estimate_method":{"oneOf":[{"type":"string","minLength":1},{"type":"null"}]},"uncertainty":{"oneOf":[{"type":"string","minLength":1},{"type":"null"}]},"unavailable_reason":{"oneOf":[{"type":"string","minLength":1},{"type":"null"}]}}}}}
