{"schema_version":"telemetry-measurement.v1","measurement_id":"measurement:codex-elapsed-synthetic","metric_kind":"elapsed_time","unit":"ms","scope":"attempt","attribution":{"provider_id":"provider:openai","model_id":"model:codex-synthetic","harness_id":"harness:codex","adapter_id":"adapter:codex-desktop","attempt_id":"attempt-synthetic-codex","native_session_ref":"native:codex-thread-1"},"source":{"type":"deterministic_local_clock","priority":4,"provenance_ref":"evidence:synthetic-local-clock"},"observed_at":"2026-08-24T12:00:05Z","source_window":{"started_at":"2026-08-24T12:00:00Z","ended_at":"2026-08-24T12:00:05Z"},"freshness":"fresh","value":{"kind":"actual","amount":5000,"estimate_method":null,"uncertainty":null,"unavailable_reason":null}}
