{"schema_version":"telemetry-measurement.v1","measurement_id":"measurement:codex-billed-cost-unavailable","metric_kind":"billed_cost","unit":"USD","scope":"attempt","attribution":{"provider_id":"provider:openai","model_id":"model:codex-synthetic","harness_id":"harness:codex","adapter_id":"adapter:codex-desktop","attempt_id":"attempt-synthetic-codex","native_session_ref":"native:codex-thread-1"},"source":{"type":"unavailable","priority":5,"provenance_ref":"evidence:synthetic-provider-cost-unavailable"},"observed_at":"2026-08-24T12:00:05Z","source_window":{"started_at":"2026-08-24T12:00:00Z","ended_at":"2026-08-24T12:00:05Z"},"freshness":"unknown","value":{"kind":"unavailable","amount":null,"estimate_method":null,"uncertainty":null,"unavailable_reason":"no approved provider billing source"}}
